{
  "schema_version": "1.0.0",
  "record_type": "result_family_mathcert_handoff",
  "handoff_id": "MC-OTP-HANDOFF-F-EHRHART",
  "candidate_id": "OPENAI-TEN-PROOFS-001",
  "result_family": "OTP-F-EHRHART",
  "producer_status": "ready_after_protected_merge",
  "authority": {
    "programme_sync_merge": "fb8e215d56714f595f328cb22b2b3f5e9410cc7b",
    "solve_sync_merge": "2bbd56688244d9803d08c0111719aed05c14a6ed",
    "cert_pre_route_merge": "993286f982c2fccc144475cdbf9a35d0c7f5f24c",
    "cert_pre_route_record": {
      "repository": "grandchallenge/MATHCERT",
      "commit_sha": "993286f982c2fccc144475cdbf9a35d0c7f5f24c",
      "path": "governance/pre_route_candidates/OPENAI_TEN_PROOFS_WP00_SYNC.json",
      "digest_algorithm": "git_blob_sha1",
      "digest": "e365b6b447e827a7f6d2e1ea7d6a264429bb85ab"
    },
    "forge_replay_merge": "72452f4579749448169cacf9f2ab22a4df2bb182",
    "forge_semantic_merge": "cb0a203c36a9ef33270d62ab369df7bc27d3b242",
    "forge_semantic_reviewed_head": "06b54c94812b2c188660e19875b6c2071b9c4fd4",
    "forge_semantic_review": {
      "review_id": 4835452029,
      "reviewer": "jimsteeg",
      "state": "APPROVED",
      "submitted_at": "2026-08-01T18:52:26Z"
    },
    "official_subject": {
      "repository": "openai/ten-proofs",
      "commit": "e62211d28e3a9131950c89caa6542cfe5eff3bca",
      "tree": "2f8e7ac5ae7f157b6b1de636c2c343b1c7a7e365",
      "archive_sha256": "3022e62ffbed8f5f74d232034a703dc645e6b301879dff1e87df72979914294f"
    },
    "semantic_record": {
      "repository": "grandchallenge/MATHFORGE",
      "commit_sha": "cb0a203c36a9ef33270d62ab369df7bc27d3b242",
      "path": "sources/OPENAI-TEN-PROOFS-001/semantic_audits/OTP-F-EHRHART.json",
      "digest_algorithm": "git_blob_sha1",
      "digest": "a3dc4de4c38a80b7aec1fae6506b08e14d2e58bb"
    }
  },
  "replay_gate": {
    "state": "clear",
    "family_clear": true,
    "aggregate_import_required": false
  },
  "semantic_gate": {
    "state": "clear",
    "source_concordance": "clear",
    "nonvacuity": "clear",
    "activated_by_protected_merge": "cb0a203c36a9ef33270d62ab369df7bc27d3b242"
  },
  "target_scope": {
    "source_theorem": "Chapter 8, Theorem 1.1, parsed P219 L18214-L18229",
    "normalized_statement": "For every positive dimension n, a full-dimensional compact convex body K in real n-space with barycenter zero and with zero as its only interior lattice point has ordinary Euclidean volume at most (n+1)^n/n!. The bound is attained by the translated dilation (n+1)Delta_n-(1,...,1); classification of all equality cases is excluded.",
    "lean_theorems": [
      "Ehrhart.Volume.ehrhart_volume_inequality_for_sets",
      "Ehrhart.SimplexVolume.exists_centeredBody_sharp",
      "Ehrhart.SimplexVolume.barycenter_centeredSimplex",
      "Ehrhart.SimplexVolume.normalizedVolume_centeredSimplex"
    ],
    "nonvacuity_witnesses": [
      "Ehrhart.SimplexVolume.exists_centeredBody_sharp",
      "Ehrhart.SimplexVolume.normalizedVolume_centeredSimplex"
    ],
    "scope_exclusions": [
      "No uniqueness or classification of all equality cases is submitted for adjudication.",
      "The packet does not independently replay the analytic proof beyond the already-clear kernel and Comparator gates."
    ]
  },
  "requested_adjudication": {
    "mode": "independent_result_family_review",
    "route_id": "MC-ROUTE-OTP-F-EHRHART",
    "current_route_state": "not_registered",
    "cert_output": null,
    "may_adjudicate_on_branch": false
  },
  "activation": {
    "condition": "exact-head CI, non-author APPROVED review, and protected MATHSOLVE merge",
    "head_change_requires_reapproval": true,
    "effect": "packet_may_be_offered_to_mathcert_for_independent_intake"
  },
  "route_controls": {
    "result_family_only": true,
    "may_create_aggregate_handoff": false,
    "may_imply_mathcert_acceptance": false,
    "may_imply_adjudication": false,
    "may_claim_mathematical_proof": false,
    "may_promote_claim": false
  },
  "claim_boundary": "This packet submits only the exact Ehrhart result family for possible independent MATHCERT intake after protected Solve activation. It does not certify the proof, classify equality cases, register or imply a Cert route or output, authorize adjudication on the branch, create an aggregate ten-proofs handoff, or promote mathematical truth, novelty, priority, publication, patentability, product, or commercial claims."
}
